543	10.693671709	192.168.1.13	192.168.1.3	TCP	58	57383 → 1723 [SYN] Seq=0 Win=1024 Len=0 MSS=1460
544	10.694696964	192.168.1.13	192.168.1.4	TCP	58	57383 → 1723 [SYN] Seq=0 Win=1024 Len=0 MSS=1460
545	10.695538083	192.168.1.13	192.168.1.7	TCP	58	57383 → 1723 [SYN] Seq=0 Win=1024 Len=0 MSS=1460
546	10.697001254	192.168.1.13	192.168.1.1	TCP	58	57383 → 1723 [SYN] Seq=0 Win=1024 Len=0 MSS=1460
547	10.697816309	192.168.1.13	192.168.1.3	TCP	58	57383 → 3389 [SYN] Seq=0 Win=1024 Len=0 MSS=1460
548	10.698597819	192.168.1.13	192.168.1.4	TCP	58	57383 → 3389 [SYN] Seq=0 Win=1024 Len=0 MSS=1460
549	10.699457615	192.168.1.13	192.168.1.7	TCP	58	57383 → 3389 [SYN] Seq=0 Win=1024 Len=0 MSS=1460
550	10.701054703	192.168.1.13	192.168.1.1	TCP	58	57383 → 3389 [SYN] Seq=0 Win=1024 Len=0 MSS=1460
551	10.701871091	192.168.1.13	192.168.1.3	TCP	58	57383 → 139 [SYN] Seq=0 Win=1024 Len=0 MSS=1460
552	10.702665955	192.168.1.13	192.168.1.4	TCP	58	57383 → 139 [SYN] Seq=0 Win=1024 Len=0 MSS=1460
556	10.788437817	192.168.1.13	192.168.1.3	TCP	58	57383 → 587 [SYN] Seq=0 Win=1024 Len=0 MSS=1460
557	10.789365429	192.168.1.13	192.168.1.4	TCP	58	57383 → 587 [SYN] Seq=0 Win=1024 Len=0 MSS=1460
558	10.789948730	192.168.1.13	192.168.1.7	TCP	58	57383 → 139 [SYN] Seq=0 Win=1024 Len=0 MSS=1460
559	10.790557620	192.168.1.13	192.168.1.1	TCP	58	57383 → 139 [SYN] Seq=0 Win=1024 Len=0 MSS=1460
560	10.791100529	192.168.1.13	192.168.1.3	TCP	58	57383 → 21 [SYN] Seq=0 Win=1024 Len=0 MSS=1460
561	10.791753089	192.168.1.13	192.168.1.4	TCP	58	57383 → 21 [SYN] Seq=0 Win=1024 Len=0 MSS=1460
564	10.800509476	192.168.1.13	192.168.1.3	TCP	58	57383 → 25 [SYN] Seq=0 Win=1024 Len=0 MSS=1460
565	10.802563410	192.168.1.13	192.168.1.3	TCP	58	57383 → 135 [SYN] Seq=0 Win=1024 Len=0 MSS=1460
566	10.804100126	192.168.1.13	192.168.1.3	TCP	58	57383 → 1720 [SYN] Seq=0 Win=1024 Len=0 MSS=1460
567	10.805932539	192.168.1.13	192.168.1.3	TCP	58	57383 → 3306 [SYN] Seq=0 Win=1024 Len=0 MSS=1460
568	10.807350153	192.168.1.13	192.168.1.3	TCP	58	57383 → 80 [SYN] Seq=0 Win=1024 Len=0 MSS=1460
572	10.811972933	192.168.1.13	192.168.1.3	TCP	58	57383 → 199 [SYN] Seq=0 Win=1024 Len=0 MSS=1460
575	10.815748447	192.168.1.13	192.168.1.3	TCP	58	57383 → 113 [SYN] Seq=0 Win=1024 Len=0 MSS=1460
576	10.817577043	192.168.1.13	192.168.1.3	TCP	58	57383 → 22 [SYN] Seq=0 Win=1024 Len=0 MSS=1460
578	10.819395436	192.168.1.13	192.168.1.3	TCP	58	57383 → 995 [SYN] Seq=0 Win=1024 Len=0 MSS=1460
582	10.831238821	192.168.1.13	192.168.1.3	TCP	58	57383 → 8080 [SYN] Seq=0 Win=1024 Len=0 MSS=1460
583	10.836817817	192.168.1.13	192.168.1.3	TCP	58	57383 → 23 [SYN] Seq=0 Win=1024 Len=0 MSS=1460
585	10.837696421	192.168.1.13	192.168.1.3	TCP	58	57383 → 445 [SYN] Seq=0 Win=1024 Len=0 MSS=1460
586	10.838399737	192.168.1.13	192.168.1.3	TCP	58	57383 → 110 [SYN] Seq=0 Win=1024 Len=0 MSS=1460
587	10.839060236	192.168.1.13	192.168.1.3	TCP	58	57383 → 8888 [SYN] Seq=0 Win=1024 Len=0 MSS=1460
588	10.839725358	192.168.1.13	192.168.1.3	TCP	58	57383 → 1025 [SYN] Seq=0 Win=1024 Len=0 MSS=1460
589	10.840859556	192.168.1.13	192.168.1.3	TCP	58	57383 → 443 [SYN] Seq=0 Win=1024 Len=0 MSS=1460
590	10.841604968	192.168.1.13	192.168.1.3	TCP	58	57383 → 554 [SYN] Seq=0 Win=1024 Len=0 MSS=1460
591	10.842230977	192.168.1.13	192.168.1.3	TCP	58	57383 → 111 [SYN] Seq=0 Win=1024 Len=0 MSS=1460
592	10.842933021	192.168.1.13	192.168.1.3	TCP	58	57383 → 5900 [SYN] Seq=0 Win=1024 Len=0 MSS=1460
593	10.843633102	192.168.1.13	192.168.1.3	TCP	58	57383 → 256 [SYN] Seq=0 Win=1024 Len=0 MSS=1460
600	10.847133437	192.168.1.13	192.168.1.3	TCP	58	57383 → 993 [SYN] Seq=0 Win=1024 Len=0 MSS=1460
605	10.849097585	192.168.1.13	192.168.1.3	TCP	58	57383 → 143 [SYN] Seq=0 Win=1024 Len=0 MSS=1460
606	10.849830091	192.168.1.13	192.168.1.3	TCP	58	57383 → 53 [SYN] Seq=0 Win=1024 Len=0 MSS=1460
607	10.850428331	192.168.1.13	192.168.1.3	TCP	58	57383 → 765 [SYN] Seq=0 Win=1024 Len=0 MSS=1460
608	10.851065852	192.168.1.13	192.168.1.3	TCP	58	57383 → 5214 [SYN] Seq=0 Win=1024 Len=0 MSS=1460
609	10.851630532	192.168.1.13	192.168.1.3	TCP	58	57383 → 2604 [SYN] Seq=0 Win=1024 Len=0 MSS=1460
610	10.852178282	192.168.1.13	192.168.1.3	TCP	58	57383 → 3889 [SYN] Seq=0 Win=1024 Len=0 MSS=1460
614	10.853108116	192.168.1.13	192.168.1.3	TCP	58	57383 → 9968 [SYN] Seq=0 Win=1024 Len=0 MSS=1460
615	10.853754754	192.168.1.13	192.168.1.3	TCP	58	57383 → 2008 [SYN] Seq=0 Win=1024 Len=0 MSS=1460
616	10.854252632	192.168.1.13	192.168.1.3	TCP	58	57383 → 9593 [SYN] Seq=0 Win=1024 Len=0 MSS=1460
617	10.854852082	192.168.1.13	192.168.1.3	TCP	58	57383 → 1287 [SYN] Seq=0 Win=1024 Len=0 MSS=1460
622	10.855901581	192.168.1.13	192.168.1.3	TCP	58	57383 → 1218 [SYN] Seq=0 Win=1024 Len=0 MSS=1460
623	10.856441677	192.168.1.13	192.168.1.3	TCP	58	57383 → 5226 [SYN] Seq=0 Win=1024 Len=0 MSS=1460
624	10.859816437	192.168.1.13	192.168.1.3	TCP	58	57383 → 5960 [SYN] Seq=0 Win=1024 Len=0 MSS=1460
625	10.860785556	192.168.1.13	192.168.1.3	TCP	58	57383 → 1104 [SYN] Seq=0 Win=1024 Len=0 MSS=1460
632	10.861970056	192.168.1.13	192.168.1.3	TCP	58	57383 → 1082 [SYN] Seq=0 Win=1024 Len=0 MSS=1460
633	10.862581330	192.168.1.13	192.168.1.3	TCP	58	57383 → 60443 [SYN] Seq=0 Win=1024 Len=0 MSS=1460
634	10.863217218	192.168.1.13	192.168.1.3	TCP	58	57383 → 4000 [SYN] Seq=0 Win=1024 Len=0 MSS=1460
635	10.863797199	192.168.1.13	192.168.1.3	TCP	58	57383 → 514 [SYN] Seq=0 Win=1024 Len=0 MSS=1460
636	10.864450577	192.168.1.13	192.168.1.3	TCP	58	57383 → 3000 [SYN] Seq=0 Win=1024 Len=0 MSS=1460
637	10.865603862	192.168.1.13	192.168.1.3	TCP	58	57383 → 2105 [SYN] Seq=0 Win=1024 Len=0 MSS=1460
638	10.866193797	192.168.1.13	192.168.1.3	TCP	58	57383 → 5822 [SYN] Seq=0 Win=1024 Len=0 MSS=1460
639	10.866749964	192.168.1.13	192.168.1.3	TCP	58	57383 → 15000 [SYN] Seq=0 Win=1024 Len=0 MSS=1460
640	10.867285952	192.168.1.13	192.168.1.3	TCP	58	57383 → 563 [SYN] Seq=0 Win=1024 Len=0 MSS=1460
641	10.867880167	192.168.1.13	192.168.1.3	TCP	58	57383 → 8085 [SYN] Seq=0 Win=1024 Len=0 MSS=1460
642	10.868922064	192.168.1.13	192.168.1.3	TCP	58	57383 → 7019 [SYN] Seq=0 Win=1024 Len=0 MSS=1460
643	10.869517610	192.168.1.13	192.168.1.3	TCP	58	57383 → 6666 [SYN] Seq=0 Win=1024 Len=0 MSS=1460
651	10.870213175	192.168.1.13	192.168.1.3	TCP	58	57383 → 30718 [SYN] Seq=0 Win=1024 Len=0 MSS=1460
652	10.870827096	192.168.1.13	192.168.1.3	TCP	58	57383 → 50500 [SYN] Seq=0 Win=1024 Len=0 MSS=1460
653	10.871359061	192.168.1.13	192.168.1.3	TCP	58	57383 → 82 [SYN] Seq=0 Win=1024 Len=0 MSS=1460
654	10.872091165	192.168.1.13	192.168.1.3	TCP	58	57383 → 2144 [SYN] Seq=0 Win=1024 Len=0 MSS=1460
662	10.873810827	192.168.1.13	192.168.1.3	TCP	58	57383 → 6059 [SYN] Seq=0 Win=1024 Len=0 MSS=1460
663	10.874612330	192.168.1.13	192.168.1.3	TCP	58	57383 → 222 [SYN] Seq=0 Win=1024 Len=0 MSS=1460
664	10.875182120	192.168.1.13	192.168.1.3	TCP	58	57383 → 8002 [SYN] Seq=0 Win=1024 Len=0 MSS=1460
665	10.876032819	192.168.1.13	192.168.1.3	TCP	58	57383 → 3814 [SYN] Seq=0 Win=1024 Len=0 MSS=1460
675	10.878165537	192.168.1.13	192.168.1.3	TCP	58	57383 → 6100 [SYN] Seq=0 Win=1024 Len=0 MSS=1460
676	10.878766402	192.168.1.13	192.168.1.3	TCP	58	57383 → 5080 [SYN] Seq=0 Win=1024 Len=0 MSS=1460
677	10.879284320	192.168.1.13	192.168.1.3	TCP	58	57383 → 1055 [SYN] Seq=0 Win=1024 Len=0 MSS=1460
678	10.880013341	192.168.1.13	192.168.1.3	TCP	58	57383 → 2022 [SYN] Seq=0 Win=1024 Len=0 MSS=1460
679	10.881215369	192.168.1.13	192.168.1.3	TCP	58	57383 → 1074 [SYN] Seq=0 Win=1024 Len=0 MSS=1460
680	10.882045861	192.168.1.13	192.168.1.3	TCP	58	57383 → 1840 [SYN] Seq=0 Win=1024 Len=0 MSS=1460
681	10.882917562	192.168.1.13	192.168.1.3	TCP	58	57383 → 10082 [SYN] Seq=0 Win=1024 Len=0 MSS=1460
682	10.883713294	192.168.1.13	192.168.1.3	TCP	58	57383 → 14000 [SYN] Seq=0 Win=1024 Len=0 MSS=1460
683	10.884514135	192.168.1.13	192.168.1.3	TCP	58	57383 → 3268 [SYN] Seq=0 Win=1024 Len=0 MSS=1460
693	10.886037863	192.168.1.13	192.168.1.3	TCP	58	57383 → 1067 [SYN] Seq=0 Win=1024 Len=0 MSS=1460
697	10.887458113	192.168.1.13	192.168.1.3	TCP	58	57383 → 1071 [SYN] Seq=0 Win=1024 Len=0 MSS=1460
698	10.888166891	192.168.1.13	192.168.1.3	TCP	58	57383 → 8193 [SYN] Seq=0 Win=1024 Len=0 MSS=1460
699	10.889239528	192.168.1.13	192.168.1.3	TCP	58	57383 → 1999 [SYN] Seq=0 Win=1024 Len=0 MSS=1460
702	10.890065433	192.168.1.13	192.168.1.3	TCP	58	57383 → 8701 [SYN] Seq=0 Win=1024 Len=0 MSS=1460
703	10.893141610	192.168.1.13	192.168.1.3	TCP	58	57383 → 3878 [SYN] Seq=0 Win=1024 Len=0 MSS=1460
708	10.894282193	192.168.1.13	192.168.1.3	TCP	58	57383 → 8194 [SYN] Seq=0 Win=1024 Len=0 MSS=1460
709	10.894966376	192.168.1.13	192.168.1.3	TCP	58	57383 → 7007 [SYN] Seq=0 Win=1024 Len=0 MSS=1460
710	10.895600067	192.168.1.13	192.168.1.3	TCP	58	57383 → 3493 [SYN] Seq=0 Win=1024 Len=0 MSS=1460
711	10.896326711	192.168.1.13	192.168.1.3	TCP	58	57383 → 4567 [SYN] Seq=0 Win=1024 Len=0 MSS=1460
712	10.897868292	192.168.1.13	192.168.1.3	TCP	58	57383 → 22939 [SYN] Seq=0 Win=1024 Len=0 MSS=1460
714	10.899094549	192.168.1.13	192.168.1.3	TCP	58	57383 → 14442 [SYN] Seq=0 Win=1024 Len=0 MSS=1460
718	10.900055390	192.168.1.13	192.168.1.3	TCP	58	57383 → 50006 [SYN] Seq=0 Win=1024 Len=0 MSS=1460
723	10.905199771	192.168.1.13	192.168.1.3	TCP	58	57383 → 5718 [SYN] Seq=0 Win=1024 Len=0 MSS=1460
724	10.906003073	192.168.1.13	192.168.1.3	TCP	58	57383 → 8087 [SYN] Seq=0 Win=1024 Len=0 MSS=1460
725	10.906614469	192.168.1.13	192.168.1.3	TCP	58	57383 → 161 [SYN] Seq=0 Win=1024 Len=0 MSS=1460
726	10.907222814	192.168.1.13	192.168.1.3	TCP	58	57383 → 1032 [SYN] Seq=0 Win=1024 Len=0 MSS=1460
727	10.907803840	192.168.1.13	192.168.1.3	TCP	58	57383 → 4242 [SYN] Seq=0 Win=1024 Len=0 MSS=1460
728	10.908452745	192.168.1.13	192.168.1.3	TCP	58	57383 → 6565 [SYN] Seq=0 Win=1024 Len=0 MSS=1460
733	10.912403350	192.168.1.13	192.168.1.3	TCP	58	57383 → 9000 [SYN] Seq=0 Win=1024 Len=0 MSS=1460